{
  "schema_version": 1,
  "run_id": "20261020T191441Z-WP4_H-P1_s2000_seed42",
  "experiment": "WP4_H-P1_s2000_seed42",
  "experiment_id": "WP4",
  "arm": "H-P1",
  "seed": 42,
  "steps": 2000,
  "status": "finished",
  "provenance": "journal-reconstructed",
  "source": "morphogenesis/logs/journal.jsonl",
  "started_at": "2026-10-20T19:14:41.094704+00:00",
  "finished_at": "2026-10-20T19:52:55.977914+00:00",
  "git_commit": null,
  "git_dirty": null,
  "command": null,
  "cwd": "morphogenesis",
  "owner": null,
  "environment": {
    "device": "cuda",
    "spec_version": "v5.6-EXP FINAL",
    "revision": "Rev.11-IMPLEMENTATION-READY",
    "batch_size": 8,
    "pool_init_mode": "target"
  },
  "checkpoint_in": null,
  "outputs": {},
  "metrics": {
    "best_loss": 0.24068066477775574,
    "alive_fraction_final": 0.15234375,
    "iterations_done": 2000,
    "wall_time_sec": 2294.88,
    "sim_steps_accumulated": 105648,
    "nan_count": 0
  },
  "stop_reason": "max_steps",
  "exit_code": null,
  "log_path": "morphogenesis/logs/WP4_H-P1_s2000_seed42_log.jsonl",
  "notes": "Восстановлено из журнала: git-коммит, команда, входной чекпоинт и хеши не сохранялись."
}
