{
  "schema_version": 1,
  "run_id": "20261023T075537Z-E09_world_base_rule",
  "experiment": "E09_world_base_rule",
  "experiment_id": "E09_pond",
  "arm": null,
  "seed": null,
  "steps": null,
  "status": "finished",
  "provenance": "runner",
  "source": "morphogenesis/logs/journal.jsonl",
  "started_at": "2026-10-23T07:55:37Z",
  "finished_at": "2026-10-23T07:58:21Z",
  "git_commit": "7083558",
  "git_dirty": true,
  "command": [
    ".\\.venv\\Scripts\\python.exe",
    "world/train_rule.py",
    "--steps",
    "1500",
    "--rollout",
    "48",
    "--grid",
    "32",
    "--size",
    "16",
    "--batch",
    "4",
    "--device",
    "cuda",
    "--out",
    "checkpoints/world_base_rule.pt"
  ],
  "cwd": "morphogenesis",
  "owner": "analyst",
  "environment": {
    "python": "3.13.11",
    "platform": "Windows-11-10.0.26300-SP0",
    "torch": "2.6.0+cu124",
    "numpy": "2.5.4",
    "device": "NVIDIA GeForce RTX 3070 Laptop GPU, 595.79"
  },
  "checkpoint_in": null,
  "outputs": {
    "declared": [
      "morphogenesis/checkpoints/world_base_rule.pt"
    ],
    "log": "morphogenesis/logs/20261023T075537Z-E09_world_base_rule.log"
  },
  "metrics": {},
  "stop_reason": "exit_0",
  "exit_code": 0,
  "log_path": "morphogenesis/logs/20261023T075537Z-E09_world_base_rule.log",
  "notes": "v0.1a (4-й прогон): маскировка живости выключена — правило может растить"
}
