{
  "schema_version": 1,
  "run_id": "20261024T183448Z-v8_propagule20_gap_weighted_seed7",
  "experiment": "v8_propagule20_gap_weighted_seed7",
  "experiment_id": "E09_pond",
  "arm": "propagule20_gap_weighted",
  "seed": 7,
  "steps": 300,
  "status": "finished",
  "provenance": "runner",
  "source": "morphogenesis/logs/journal.jsonl",
  "started_at": "2026-10-24T18:34:48Z",
  "finished_at": "2026-10-24T18:36:21Z",
  "git_commit": "788b191",
  "git_dirty": true,
  "command": [
    "C:\\Users\\Admin\\Documents\\Qoder\\2026-10-18\\82ab86cd\\repo\\.venv\\Scripts\\python.exe",
    "run_exploratory.py",
    "--script",
    "../../_hourly/colinv4_driver.py",
    "--experiment",
    "v8_propagule20_gap_weighted_seed7",
    "--device",
    "cuda"
  ],
  "cwd": "morphogenesis",
  "owner": "scientist",
  "environment": {
    "python": "3.13.11",
    "platform": "Windows-11-10.0.26300-SP0",
    "torch": "2.6.0+cu124",
    "numpy": "2.5.4",
    "device": "NVIDIA GeForce RTX 3070 Laptop GPU, 595.79"
  },
  "checkpoint_in": null,
  "outputs": {
    "declared": [],
    "log": "morphogenesis/logs/20261024T183448Z-v8_propagule20_gap_weighted_seed7.log"
  },
  "metrics": {},
  "stop_reason": "exit_0",
  "exit_code": 0,
  "log_path": "morphogenesis/logs/20261024T183448Z-v8_propagule20_gap_weighted_seed7.log",
  "notes": "V8: placement=gap, merge=mass_weighted, cells=20, empty=False"
}
