{
  "schema_version": 1,
  "run_id": "20261026T020059Z-w2bud_onebud_cell_seed101",
  "experiment": "w2bud_onebud_cell_seed101",
  "experiment_id": "E09_pond",
  "arm": "w2bud_onebud",
  "seed": 101,
  "steps": 600,
  "status": "finished",
  "provenance": "runner",
  "source": "morphogenesis/logs/journal.jsonl",
  "started_at": "2026-10-26T02:01:00Z",
  "finished_at": "2026-10-26T02:05:45Z",
  "git_commit": "5ff972f",
  "git_dirty": false,
  "command": [
    "C:\\Users\\Admin\\Documents\\Qoder\\2026-10-18\\82ab86cd\\repo\\.venv\\Scripts\\python.exe",
    "run_exploratory.py",
    "--script",
    "../../_hourly/colinv4_driver.py",
    "--experiment",
    "w2bud_onebud_cell_seed101",
    "--device",
    "cuda"
  ],
  "cwd": "morphogenesis",
  "owner": "scientist",
  "environment": {
    "python": "3.13.11",
    "platform": "Windows-11-10.0.26300-SP0",
    "torch": "2.6.0+cu124",
    "numpy": "2.5.4",
    "device": "NVIDIA GeForce RTX 3070 Laptop GPU, 595.79"
  },
  "checkpoint_in": null,
  "outputs": {
    "declared": [],
    "log": "morphogenesis/logs/20261026T020059Z-w2bud_onebud_cell_seed101.log"
  },
  "metrics": {},
  "stop_reason": "exit_0",
  "exit_code": 0,
  "log_path": "morphogenesis/logs/20261026T020059Z-w2bud_onebud_cell_seed101.log",
  "notes": "H-ALIVE-45: one-bud-per-lineage"
}
