{
  "schema_version": 1,
  "run_id": "20261025T051610Z-w2bud_colony_seed6",
  "experiment": "w2bud_colony_seed6",
  "experiment_id": "E09_pond",
  "arm": "w2bud_colony",
  "seed": 6,
  "steps": 600,
  "status": "finished",
  "provenance": "runner",
  "source": "morphogenesis/logs/journal.jsonl",
  "started_at": "2026-10-25T05:16:10Z",
  "finished_at": "2026-10-25T05:20:27Z",
  "git_commit": "4910241",
  "git_dirty": true,
  "command": [
    "C:\\Users\\Admin\\Documents\\Qoder\\2026-10-18\\82ab86cd\\repo\\.venv\\Scripts\\python.exe",
    "run_exploratory.py",
    "--script",
    "../../_hourly/colinv4_driver.py",
    "--experiment",
    "w2bud_colony_seed6",
    "--device",
    "cuda"
  ],
  "cwd": "morphogenesis",
  "owner": "scientist",
  "environment": {
    "python": "3.13.11",
    "platform": "Windows-11-10.0.26300-SP0",
    "torch": "2.6.0+cu124",
    "numpy": "2.5.4",
    "device": "NVIDIA GeForce RTX 3070 Laptop GPU, 595.79"
  },
  "checkpoint_in": null,
  "outputs": {
    "declared": [],
    "log": "morphogenesis/logs/20261025T051610Z-w2bud_colony_seed6.log"
  },
  "metrics": {},
  "stop_reason": "exit_0",
  "exit_code": 0,
  "log_path": "morphogenesis/logs/20261025T051610Z-w2bud_colony_seed6.log",
  "notes": "W2-bud: budding-unit=colony, 600 steps, m=0.05"
}
