{
  "schema_version": 1,
  "run_id": "20261023T031805Z-E08_fp32_3000_anomaly",
  "experiment": "E08_fp32_3000_anomaly",
  "experiment_id": "E08_precision_horizon",
  "arm": null,
  "seed": null,
  "steps": null,
  "status": "failed",
  "provenance": "runner",
  "source": "morphogenesis/logs/journal.jsonl",
  "started_at": "2026-10-23T03:18:05Z",
  "finished_at": "2026-10-23T03:18:17Z",
  "git_commit": "c8709fa",
  "git_dirty": true,
  "command": [
    "C:\\Users\\Admin\\Documents\\Qoder\\2026-10-18\\82ab86cd\\repo\\.venv\\Scripts\\python.exe",
    "../scripts/morphometry.py",
    "--checkpoint",
    "checkpoints/E02c_R-9_s3000_seed42_fp32",
    "--mode",
    "boundary",
    "--starts",
    "16"
  ],
  "cwd": "morphogenesis",
  "owner": "analyst",
  "environment": {
    "python": "3.13.11",
    "platform": "Windows-11-10.0.26300-SP0",
    "torch": "2.6.0+cu124",
    "numpy": "2.5.4",
    "device": "NVIDIA GeForce RTX 3070 Laptop GPU, 595.79"
  },
  "checkpoint_in": null,
  "outputs": {
    "declared": [
      "morphogenesis/experiments/E02c_replication/morphometry_E02c_R-9_s3000_seed42_fp32_boundary.json"
    ],
    "log": "morphogenesis/logs/20261023T031805Z-E08_fp32_3000_anomaly.log"
  },
  "metrics": {},
  "stop_reason": "exit_1",
  "exit_code": 1,
  "log_path": "morphogenesis/logs/20261023T031805Z-E08_fp32_3000_anomaly.log",
  "notes": "аномалия FP32@3000: alive 0.825 при binary 0.011"
}
