{
  "schema_version": 1,
  "run_id": "20261029T130212Z-w2bud_patch_sham_seed171",
  "experiment": "w2bud_patch_sham_seed171",
  "experiment_id": "E09_pond",
  "arm": "w2bud_patch_sham",
  "seed": 171,
  "steps": 600,
  "status": "finished",
  "provenance": "runner",
  "source": "morphogenesis/logs/journal.jsonl",
  "started_at": "2026-10-29T13:02:12Z",
  "finished_at": "2026-10-29T13:07:42Z",
  "git_commit": "4a29d86",
  "git_dirty": true,
  "command": [
    "C:\\Users\\Admin\\Documents\\Qoder\\2026-10-18\\82ab86cd\\repo\\.venv\\Scripts\\python.exe",
    "run_exploratory.py",
    "--script",
    "../../_hourly/colinv4_driver.py",
    "--experiment",
    "w2bud_patch_sham_seed171",
    "--device",
    "cuda"
  ],
  "cwd": "morphogenesis",
  "owner": "lead",
  "environment": {
    "python": "3.13.11",
    "platform": "Windows-11-10.0.26300-SP0",
    "torch": "2.6.0+cu124",
    "numpy": "2.5.4",
    "device": "NVIDIA GeForce RTX 3070 Laptop GPU, 595.79"
  },
  "checkpoint_in": null,
  "outputs": {
    "declared": [],
    "log": "morphogenesis/logs/20261029T130212Z-w2bud_patch_sham_seed171.log"
  },
  "metrics": {},
  "stop_reason": "exit_0",
  "exit_code": 0,
  "log_path": "morphogenesis/logs/20261029T130212Z-w2bud_patch_sham_seed171.log",
  "notes": "H-ALIVE-74 площадка"
}
