{
  "schema_version": 1,
  "run_id": "20261022T172330Z-E02b_asymmetry_sides",
  "experiment": "E02b_asymmetry_sides",
  "experiment_id": "E02b",
  "arm": "R-9",
  "seed": 42,
  "steps": 2000,
  "status": "finished",
  "provenance": "runner",
  "source": "morphogenesis/logs/journal.jsonl",
  "started_at": "2026-10-22T17:23:30Z",
  "finished_at": "2026-10-22T17:28:26Z",
  "git_commit": "4b7da5a",
  "git_dirty": true,
  "command": [
    "C:\\Users\\Admin\\Documents\\Qoder\\2026-10-18\\82ab86cd\\repo\\.venv\\Scripts\\python.exe",
    "run_exploratory.py",
    "--script",
    "experiments/E02b_morphospace/scripts/e02b_asymmetry_sides.py",
    "--experiment",
    "E02b_asymmetry_sides",
    "--note",
    "H-AB-9 по протоколу 2026-10-22-asymmetry-sides-plan.md"
  ],
  "cwd": "morphogenesis",
  "owner": "lead",
  "environment": {
    "python": "3.13.11",
    "platform": "Windows-11-10.0.26300-SP0",
    "torch": "2.6.0+cu124",
    "numpy": "2.5.4",
    "device": "NVIDIA GeForce RTX 3070 Laptop GPU, 595.79"
  },
  "checkpoint_in": null,
  "outputs": {
    "declared": [],
    "log": "morphogenesis/logs/20261022T172330Z-E02b_asymmetry_sides.log"
  },
  "metrics": {},
  "stop_reason": "exit_0",
  "exit_code": 0,
  "log_path": "morphogenesis/logs/20261022T172330Z-E02b_asymmetry_sides.log",
  "notes": ""
}
