{
  "schema_version": 1,
  "run_id": "20261025T210000Z-w2bud6_cell_seed103",
  "experiment": "w2bud6_cell_seed103",
  "experiment_id": "E09_pond",
  "arm": "rep_patches_cell",
  "seed": 103,
  "steps": 600,
  "status": "finished",
  "provenance": "runner",
  "source": "morphogenesis/logs/journal.jsonl",
  "started_at": "2026-10-25T21:00:01Z",
  "finished_at": "2026-10-25T21:03:57Z",
  "git_commit": "d826ebe",
  "git_dirty": true,
  "command": [
    "C:\\Users\\Admin\\Documents\\Qoder\\2026-10-18\\82ab86cd\\repo\\.venv\\Scripts\\python.exe",
    "run_exploratory.py",
    "--script",
    "../../_hourly/colinv4_driver.py",
    "--experiment",
    "w2bud6_cell_seed103",
    "--device",
    "cuda"
  ],
  "cwd": "morphogenesis",
  "owner": "scientist",
  "environment": {
    "python": "3.13.11",
    "platform": "Windows-11-10.0.26300-SP0",
    "torch": "2.6.0+cu124",
    "numpy": "2.5.4",
    "device": "NVIDIA GeForce RTX 3070 Laptop GPU, 595.79"
  },
  "checkpoint_in": null,
  "outputs": {
    "declared": [],
    "log": "morphogenesis/logs/20261025T210000Z-w2bud6_cell_seed103.log"
  },
  "metrics": {},
  "stop_reason": "exit_0",
  "exit_code": 0,
  "log_path": "morphogenesis/logs/20261025T210000Z-w2bud6_cell_seed103.log",
  "notes": "H-ALIVE-40: replication, layout=patches, unit=cell"
}
