{
  "schema_version": 1,
  "run_id": "20261026T040044Z-w1niche5_legacy_seed5",
  "experiment": "w1niche5_legacy_seed5",
  "experiment_id": "E09_pond",
  "arm": "w1niche5_legacy",
  "seed": 5,
  "steps": 300,
  "status": "finished",
  "provenance": "runner",
  "source": "morphogenesis/logs/journal.jsonl",
  "started_at": "2026-10-26T04:00:44Z",
  "finished_at": "2026-10-26T04:02:08Z",
  "git_commit": "97edae9",
  "git_dirty": true,
  "command": [
    "C:\\Users\\Admin\\Documents\\Qoder\\2026-10-18\\82ab86cd\\repo\\.venv\\Scripts\\python.exe",
    "run_exploratory.py",
    "--script",
    "../../_hourly/colinv4_driver.py",
    "--experiment",
    "w1niche5_legacy_seed5",
    "--device",
    "cuda"
  ],
  "cwd": "morphogenesis",
  "owner": "scientist",
  "environment": {
    "python": "3.13.11",
    "platform": "Windows-11-10.0.26300-SP0",
    "torch": "2.6.0+cu124",
    "numpy": "2.5.4",
    "device": "NVIDIA GeForce RTX 3070 Laptop GPU, 595.79"
  },
  "checkpoint_in": null,
  "outputs": {
    "declared": [],
    "log": "morphogenesis/logs/20261026T040044Z-w1niche5_legacy_seed5.log"
  },
  "metrics": {},
  "stop_reason": "exit_0",
  "exit_code": 0,
  "log_path": "morphogenesis/logs/20261026T040044Z-w1niche5_legacy_seed5.log",
  "notes": "H-ALIVE-46 v5: legacy"
}
